post_content,trend,Likes,Shares,Comments
northern ireland footballer filmed masturbating road friend,Moderately Trending,928,156,74
sachin biopic taxfree release states,Low Trending,892,197,220
air force hosts hackathon pays finding bugs,Highly Trending,975,185,51
yearold indian boxer defeats olympic champion,Highly Trending,937,185,39
sc orders floor test karnataka assembly tomorrow pm,Highly Trending,981,173,93
thailand raids temples arrests monks clean buddhism,Highly Trending,894,179,155
sabarimala shut purification entry women,Moderately Trending,882,136,2
telangana cm work coolie bear cost partys meet,Low Trending,614,167,112
donald trumps washington hotel saw crore revenue,Moderately Trending,968,115,68
st flights day depart time orders air india,Moderately Trending,831,140,34
half cheques dds sent kerala relief fund dishonoured cm,Highly Trending,966,192,15
indian squash player registers st straight intl win,Highly Trending,806,197,88
indias st govtsponsored transgender poet meet organised,Low Trending,834,180,171
zayn malik girlfriend gigi celebrate eid moms,Low Trending,959,154,168
indians kidnapped isis iraq died swaraj,Low Trending,758,147,98
hundreds flyers miss flights security scanner fault,Low Trending,837,145,78
firstever jail till death sentence issued nepal,Low Trending,815,160,96
recite hanuman chalisa rid monkeys cm adityanath,Moderately Trending,843,170,20
years vasco da gama arrived india,Low Trending,801,199,46
air india flights delayed software malfunction,Highly Trending,880,186,7
dad missed priyanka birth anniversary,Low Trending,842,173,117
arsenal win wengers th pl match man utd beat spurs,Moderately Trending,759,134,41
chipbased atm card hacked rare case woman loses,Low Trending,701,135,138
haryana folk singers body slit throat rohtak,Moderately Trending,902,142,39
pietersen names sachin sehwag openers test xi,Highly Trending,878,200,118
